{"$id":"https://orbital-dynamics.local/schemas/timeline_preservation_report.v1.schema.json","$schema":"https://json-schema.org/draft/2020-12/schema","additionalProperties":true,"properties":{"activity_count":{"minimum":0,"type":"integer"},"activity_id_sets_by_protection_category":{"additionalProperties":{"items":{"pattern":"^[A-Za-z0-9][A-Za-z0-9._:@-]*$","type":"string"},"type":"array"},"type":"object"},"activity_id_sets_by_protection_decision":{"additionalProperties":{"items":{"pattern":"^[A-Za-z0-9][A-Za-z0-9._:@-]*$","type":"string"},"type":"array"},"type":"object"},"activity_id_sets_by_protection_reason":{"additionalProperties":{"items":{"pattern":"^[A-Za-z0-9][A-Za-z0-9._:@-]*$","type":"string"},"type":"array"},"type":"object"},"assumptions":{"additionalProperties":true,"properties":{"execution_boundary":{"const":"artifact_only_no_schedule_mutation","type":"string"},"scope":{"const":"lifecycle_lock_approval_and_executed_preservation_review","type":"string"}},"required":["execution_boundary","scope"],"type":"object"},"model":{"const":"artifact_only_lifecycle_preservation_summary","type":"string"},"model_limits":{"const":["artifact_level_only","no_schedule_mutation","no_command_execution","derived_identity_when_no_persistent_timeline_id"],"items":{"enum":["artifact_level_only","no_schedule_mutation","no_command_execution","derived_identity_when_no_persistent_timeline_id"],"type":"string"},"type":"array"},"mutable_activity_count":{"minimum":0,"type":"integer"},"mutable_activity_ids":{"items":{"pattern":"^[A-Za-z0-9][A-Za-z0-9._:@-]*$","type":"string"},"type":"array"},"preservation_sensitive_activity_count":{"minimum":0,"type":"integer"},"preservation_sensitive_activity_ids":{"items":{"pattern":"^[A-Za-z0-9][A-Za-z0-9._:@-]*$","type":"string"},"type":"array"},"preservation_sensitive_timeline_ids":{"items":{"pattern":"^[A-Za-z0-9][A-Za-z0-9._:@-]*$","type":"string"},"type":"array"},"preserve_activity_count":{"minimum":0,"type":"integer"},"preserve_activity_ids":{"items":{"pattern":"^[A-Za-z0-9][A-Za-z0-9._:@-]*$","type":"string"},"type":"array"},"preserve_timeline_ids":{"items":{"pattern":"^[A-Za-z0-9][A-Za-z0-9._:@-]*$","type":"string"},"type":"array"},"protection_category_counts":{"additionalProperties":{"minimum":0,"type":"integer"},"type":"object"},"protection_decision_counts":{"additionalProperties":{"minimum":0,"type":"integer"},"type":"object"},"protection_reason_counts":{"additionalProperties":{"minimum":0,"type":"integer"},"type":"object"},"review_change_activity_count":{"minimum":0,"type":"integer"},"review_change_activity_ids":{"items":{"pattern":"^[A-Za-z0-9][A-Za-z0-9._:@-]*$","type":"string"},"type":"array"},"review_change_timeline_ids":{"items":{"pattern":"^[A-Za-z0-9][A-Za-z0-9._:@-]*$","type":"string"},"type":"array"},"rows":{"items":{"additionalProperties":true,"properties":{"activity_id":{"pattern":"^[A-Za-z0-9][A-Za-z0-9._:@-]*$","type":"string"},"approval_status":{"type":"string"},"approved":{"type":"boolean"},"invalid_activity_input":{"type":"boolean"},"invalid_activity_input_reason":{"type":"string"},"locked":{"type":"boolean"},"protection_category":{"type":"string"},"protection_decision":{"type":"string"},"reason":{"type":"string"},"status":{"type":"string"},"timeline_id":{"pattern":"^[A-Za-z0-9][A-Za-z0-9._:@-]*$","type":"string"},"timeline_identity":{"additionalProperties":true,"properties":{"activity_id":{"pattern":"^[A-Za-z0-9][A-Za-z0-9._:@-]*$","type":"string"},"activity_type":{"type":"string"},"scenario_id":{"pattern":"^[A-Za-z0-9][A-Za-z0-9._:@-]*$","type":"string"},"source_window_id":{"pattern":"^[A-Za-z0-9][A-Za-z0-9._:@-]*$","type":"string"},"subject_id":{"type":"string"},"timeline_id":{"pattern":"^[A-Za-z0-9][A-Za-z0-9._:@-]*$","type":"string"}},"type":"object"}},"type":"object"},"type":"array"},"schema_contract":{"const":"timeline_preservation_report.v1","type":"string"},"source":{"type":"string"},"timeline_id_sets_by_protection_category":{"additionalProperties":{"items":{"pattern":"^[A-Za-z0-9][A-Za-z0-9._:@-]*$","type":"string"},"type":"array"},"type":"object"},"timeline_id_sets_by_protection_decision":{"additionalProperties":{"items":{"pattern":"^[A-Za-z0-9][A-Za-z0-9._:@-]*$","type":"string"},"type":"array"},"type":"object"},"timeline_id_sets_by_protection_reason":{"additionalProperties":{"items":{"pattern":"^[A-Za-z0-9][A-Za-z0-9._:@-]*$","type":"string"},"type":"array"},"type":"object"},"timeline_preservation_status":{"enum":["clear","preservation_required","review_required"],"type":"string"}},"required":["schema_contract","model","source","activity_count","mutable_activity_count","preserve_activity_count","review_change_activity_count","preservation_sensitive_activity_count","timeline_preservation_status","protection_decision_counts","protection_category_counts","protection_reason_counts","preserve_activity_ids","preserve_timeline_ids","review_change_activity_ids","review_change_timeline_ids","mutable_activity_ids","preservation_sensitive_activity_ids","preservation_sensitive_timeline_ids","activity_id_sets_by_protection_decision","timeline_id_sets_by_protection_decision","activity_id_sets_by_protection_category","timeline_id_sets_by_protection_category","activity_id_sets_by_protection_reason","timeline_id_sets_by_protection_reason","rows","assumptions"],"title":"OrbitalDynamics timeline_preservation_report.v1","type":"object","x-orbital-dynamics":{"artifact_family":"timeline_preservation_report","compatibility_policy":{"breaking_change_action":"mint a new schema_contract name or increment the artifact schema_version before publishing","breaking_changes":["remove_required_fields","change_required_field_type","change_schema_contract_identifier","change_schema_version_const","change_required_field_semantics"],"compatible_changes":["add_optional_fields","add_optional_nested_contracts","tighten_executable_semantic_validation_without_changing_exported_required_fields"],"policy_version":1,"validation_mode":"top_level_compatibility_export"},"compatibility_policy_version":1,"executable_contract":true,"identity_policy":{"breaking_changes":["change_existing_public_identifier_for_the_same_semantic_entity","emit_blank_identifier","emit_identifier_with_whitespace"],"compatible_changes":["add_optional_identifier_fields","add_more_specific_semantic_source_metadata_without_changing_existing_ids"],"description":"Public artifact identifiers are non-empty machine identifiers without whitespace.","generated_id_scopes":[{"identity_fields":["scenario_id","type","source_window_id","target_id","ground_station_id"],"ordering":["result_event_type","scenario_id","source_window_id","starts_at_s"],"scope":"candidate_refresh.v1.candidate_activities"},{"generated_id_field":"id","identity_fields":["type","scenario_id","target_id","ground_station_id","starts_at_s","ends_at_s"],"ordering":["type","scenario_id","target_id","ground_station_id","starts_at_s","id"],"scope":"candidate_refresh.v1.refreshed_windows.generated_window_id","semantic_invariants":["source_record_order_must_not_change_generated_window_id","canonical_source_event_sort_key_must_drive_window_index","same_semantic_source_window_must_keep_generated_window_id"]},{"identity_fields":["spacecraft_id","scenario_id","epoch.seconds_since_j2000"],"ordering":["spacecraft_id","scenario_id","epoch.seconds_since_j2000"],"scope":"accepted_planning_state.v1.spacecraft_states"},{"generated_id_field":"id","identity_fields":["resource_scope","ground_station_id","spacecraft_id","starts_at_s","ends_at_s","contact_ids"],"ordering":["resource_scope","ground_station_id","spacecraft_id","starts_at_s","id"],"scope":"contact_contention_report.v1.conflict_groups.generated_group_id","semantic_invariants":["source_record_order_must_not_change_generated_group_id","canonical_contact_sort_key_must_drive_conflict_group_index","same_semantic_contention_group_must_keep_generated_group_id"]},{"generated_id_field":"group_id","identity_fields":["group_id","resource_scope","ground_station_id","spacecraft_id","starts_at_s","selected_contact_id","deferred_contact_ids"],"ordering":["resource_scope","ground_station_id","spacecraft_id","starts_at_s","group_id"],"scope":"contact_contention_resolution_report.v1.recommendations.generated_group_id","semantic_invariants":["contention_group_id_must_flow_to_recommendation_group_id","source_record_order_must_not_change_recommendation_group_id","resolution_ordering_must_not_change_group_identity"]},{"explicit_id_fields":["route_id","id","data_path_id"],"identity_fields":["source_spacecraft_id","relay_chain_spacecraft_ids","ground_station_id","ground_downlink_contact_id","latency_s","latency_limit_s","product_ids","collection_ids"],"ordering":["source_spacecraft_id","ground_downlink_contact_id","semantic_route_fingerprint"],"scope":"relay_data_path_summary.v1.rows.generated_route_id","semantic_invariants":["source_record_order_must_not_change_generated_route_id","semantic_route_evidence_changes_must_change_generated_route_id","explicit_route_id_takes_precedence_over_generated_route_id"]},{"generated_id_field":"publication_id","identity_fields":["publication_sequence","source_artifact_id","supersedes_artifact_ids"],"ordering":["publication_sequence","source_artifact_id","supersedes_artifact_ids"],"scope":"timeline_publication_summary.v1.publication_id","semantic_invariants":["source_record_order_must_not_change_publication_id","same_publication_sequence_and_artifact_lineage_must_keep_publication_id","publication_id_serializes_declared_artifact_lineage"]}],"policy_version":1,"semantic_invariants":["source_record_order_must_not_change_generated_identity","semantic_source_identity_must_remain_stable_across_manifest_export","scenario_and_activity_identity_must_not_depend_on_wall_clock_time"],"stable_id_pattern":"^[A-Za-z0-9][A-Za-z0-9._:@-]*$"},"identity_policy_version":1,"nested_contract_definition_scope":"direct_declared_contracts","nested_contracts":[],"schema_contract":"timeline_preservation_report.v1","schema_version":1,"validation_mode":"top_level_compatibility_export"}}
