{"activity_count":4,"activity_id_sets_by_protection_category":{"executed":["obs_done"],"invalid_activity_input":["bad_missing_type"],"locked_or_approved":["contact_locked"],"none":["cmd_mutable"]},"activity_id_sets_by_protection_decision":{"mutable":["cmd_mutable"],"preserve":["contact_locked","obs_done"],"review_change":["bad_missing_type"]},"activity_id_sets_by_protection_reason":{"activity_already_completed":["obs_done"],"activity_locked_or_approved":["contact_locked"],"missing_activity_type":["bad_missing_type"],"no_timeline_protection":["cmd_mutable"]},"assumptions":{"execution_boundary":"artifact_only_no_schedule_mutation","scope":"lifecycle_lock_approval_and_executed_preservation_review","source":"validation.timeline_preservation_report"},"model":"artifact_only_lifecycle_preservation_summary","mutable_activity_count":1,"mutable_activity_ids":["cmd_mutable"],"preservation_sensitive_activity_count":3,"preservation_sensitive_activity_ids":["bad_missing_type","contact_locked","obs_done"],"preservation_sensitive_timeline_ids":["timeline:invalid_activity_input:bad_missing_type","timeline:observe","timeline:planned_contact"],"preserve_activity_count":2,"preserve_activity_ids":["contact_locked","obs_done"],"preserve_timeline_ids":["timeline:observe","timeline:planned_contact"],"protection_category_counts":{"executed":1,"invalid_activity_input":1,"locked_or_approved":1,"none":1},"protection_decision_counts":{"mutable":1,"preserve":2,"review_change":1},"protection_reason_counts":{"activity_already_completed":1,"activity_locked_or_approved":1,"missing_activity_type":1,"no_timeline_protection":1},"review_change_activity_count":1,"review_change_activity_ids":["bad_missing_type"],"review_change_timeline_ids":["timeline:invalid_activity_input:bad_missing_type"],"rows":[{"activity_id":"contact_locked","approval_status":"not_evaluated","approved":false,"locked":true,"protection_category":"locked_or_approved","protection_decision":"preserve","reason":"activity_locked_or_approved","status":"planned","timeline_id":"timeline:planned_contact","timeline_identity":{"activity_id":"contact_locked","activity_type":"contact","timeline_id":"timeline:planned_contact"}},{"activity_id":"obs_done","approval_status":"not_evaluated","approved":false,"locked":false,"protection_category":"executed","protection_decision":"preserve","reason":"activity_already_completed","status":"completed","timeline_id":"timeline:observe","timeline_identity":{"activity_id":"obs_done","activity_type":"observe","timeline_id":"timeline:observe"}},{"activity_id":"bad_missing_type","approval_status":"operator_review_required","approved":false,"invalid_activity_input":true,"invalid_activity_input_reason":"missing_activity_type","locked":false,"protection_category":"invalid_activity_input","protection_decision":"review_change","reason":"missing_activity_type","status":"invalid","timeline_id":"timeline:invalid_activity_input:bad_missing_type","timeline_identity":{"activity_id":"bad_missing_type","activity_type":"invalid_activity_input","timeline_id":"timeline:invalid_activity_input:bad_missing_type"}}],"schema_contract":"timeline_preservation_report.v1","source":"validation.timeline_preservation_report","timeline_id_sets_by_protection_category":{"executed":["timeline:observe"],"invalid_activity_input":["timeline:invalid_activity_input:bad_missing_type"],"locked_or_approved":["timeline:planned_contact"],"none":["timeline:command"]},"timeline_id_sets_by_protection_decision":{"mutable":["timeline:command"],"preserve":["timeline:observe","timeline:planned_contact"],"review_change":["timeline:invalid_activity_input:bad_missing_type"]},"timeline_id_sets_by_protection_reason":{"activity_already_completed":["timeline:observe"],"activity_locked_or_approved":["timeline:planned_contact"],"missing_activity_type":["timeline:invalid_activity_input:bad_missing_type"],"no_timeline_protection":["timeline:command"]},"timeline_preservation_status":"review_required","model_limits":["artifact_level_only","no_schedule_mutation","no_command_execution","derived_identity_when_no_persistent_timeline_id"]}
